{
  "compRoot": 0,
  "regions": [
    {
      "id": 0,
      "type": "plane",
      "origin": "planeGrow",
      "ax": {
        "loc": [
          0.0,
          3.0,
          0.0
        ],
        "dir": [
          1.0,
          0.0,
          0.0
        ],
        "xdir": [
          0.0,
          1.0,
          0.0
        ]
      },
      "radius": 0.0,
      "uMin": 0.0,
      "uMax": 0.0,
      "vMin": 0.0,
      "vMax": 0.0,
      "closed360": false,
      "outwardNormal": true,
      "tris": [
        0,
        1
      ],
      "loops": [
        {
          "chainIdx": [
            0,
            1
          ],
          "reversed": [
            0,
            1
          ],
          "role": "outer"
        }
      ],
      "maxVertexDev": 0.0,
      "rmsVertexDev": 0.0,
      "chordSagitta": 0.0,
      "nSides": 0,
      "dVolPredicted": 0.0,
      "maxVertexSnap": 0.0,
      "reject": "none",
      "builtAs": "notBuilt",
      "filletNbrA": -1,
      "filletNbrB": -1
    },
    {
      "id": 1,
      "type": "plane",
      "origin": "planeGrow",
      "ax": {
        "loc": [
          3.0,
          0.0,
          0.0
        ],
        "dir": [
          0.0,
          1.0,
          0.0
        ],
        "xdir": [
          1.0,
          0.0,
          0.0
        ]
      },
      "radius": 0.0,
      "uMin": 0.0,
      "uMax": 0.0,
      "vMin": 0.0,
      "vMax": 0.0,
      "closed360": false,
      "outwardNormal": true,
      "tris": [
        2,
        3
      ],
      "loops": [
        {
          "chainIdx": [
            2,
            3
          ],
          "reversed": [
            0,
            0
          ],
          "role": "outer"
        }
      ],
      "maxVertexDev": 0.0,
      "rmsVertexDev": 0.0,
      "chordSagitta": 0.0,
      "nSides": 0,
      "dVolPredicted": 0.0,
      "maxVertexSnap": 0.0,
      "reject": "none",
      "builtAs": "notBuilt",
      "filletNbrA": -1,
      "filletNbrB": -1
    },
    {
      "id": 2,
      "type": "cylinder",
      "origin": "filletStrip",
      "ax": {
        "loc": [
          3.0,
          3.0,
          4.0
        ],
        "dir": [
          0.0,
          0.0,
          1.0
        ],
        "xdir": [
          -1.0,
          0.0,
          0.0
        ]
      },
      "radius": 3.0,
      "uMin": 3.141592653589793,
      "uMax": 4.71238898038469,
      "vMin": -4.0,
      "vMax": 4.0,
      "closed360": false,
      "outwardNormal": false,
      "tris": [
        4,
        5
      ],
      "loops": [
        {
          "chainIdx": [
            1,
            2,
            4,
            5
          ],
          "reversed": [
            0,
            1,
            0,
            0
          ],
          "role": "outer"
        }
      ],
      "maxVertexDev": 0.0,
      "rmsVertexDev": 0.0,
      "chordSagitta": 0.8786796564403573,
      "nSides": 4,
      "dVolPredicted": -20.548667764616276,
      "maxVertexSnap": 0.0,
      "reject": "none",
      "builtAs": "notBuilt",
      "filletNbrA": 0,
      "filletNbrB": 1
    }
  ],
  "rejected": [],
  "chains": [
    {
      "regA": 0,
      "regB": -1,
      "islandA": -1,
      "islandB": -1,
      "tangent": false,
      "closedLoop": false,
      "meshEdges": [
        0,
        1,
        3
      ],
      "meshVerts": [
        0,
        1,
        2,
        3
      ]
    },
    {
      "regA": 2,
      "regB": 0,
      "islandA": -1,
      "islandB": -1,
      "tangent": true,
      "closedLoop": false,
      "meshEdges": [
        4
      ],
      "meshVerts": [
        0,
        3
      ]
    },
    {
      "regA": 1,
      "regB": 2,
      "islandA": -1,
      "islandB": -1,
      "tangent": true,
      "closedLoop": false,
      "meshEdges": [
        5
      ],
      "meshVerts": [
        4,
        5
      ]
    },
    {
      "regA": 1,
      "regB": -1,
      "islandA": -1,
      "islandB": -1,
      "tangent": false,
      "closedLoop": false,
      "meshEdges": [
        6,
        8,
        9
      ],
      "meshVerts": [
        5,
        6,
        7,
        4
      ]
    },
    {
      "regA": 2,
      "regB": -1,
      "islandA": -1,
      "islandB": -1,
      "tangent": false,
      "closedLoop": false,
      "meshEdges": [
        10
      ],
      "meshVerts": [
        3,
        5
      ]
    },
    {
      "regA": 2,
      "regB": -1,
      "islandA": -1,
      "islandB": -1,
      "tangent": false,
      "closedLoop": false,
      "meshEdges": [
        12
      ],
      "meshVerts": [
        4,
        0
      ]
    }
  ],
  "triRegion": [
    0,
    0,
    1,
    1,
    2,
    2
  ],
  "triIsland": [
    -1,
    -1,
    -1,
    -1,
    -1,
    -1
  ],
  "nIslands": 0,
  "stats": {
    "planes": 2,
    "cylinders": 1,
    "fillets": 1,
    "rejected": 0,
    "facetIslands": 0,
    "facetTriangles": 0,
    "distinctRadii": 1,
    "maxVertexDev": 0.0,
    "maxEdgeTol": 0.0,
    "dVolPredicted": -20.548667764616276
  }
}
